<?xml version="1.0" encoding="UTF-8"?>
<apis basePath = "${frontPath}/api/myCoupons"
      xmlns:xsi="http://www.w3.org/2001/XMLSchema-instance"
      xsi:noNamespaceSchemaLocation="../../config/api.xsd">
    	<api path="cashCoupon">
		<data>
			<foramt>
			{	
				code:{
				   description:"状态代码（0表示成功，1表示token无效，其它值表示失败）",
				   type:"int",
				   optional:"FALSE"   },
				text:{
				   description:"状态描述",
				   type:"String",
				   optional:"FALSE"   },
				data:{
				  count:{
					 description:"记录总数",
					 type:"int",
					 optional:"FALSE"     },
				  resultList:[
					{
					  ticketId:{
						 description:"投资券Id",
						 type:"int",
						 optional:"FALSE",
				         dataColumn:"id"         },
					  type:{
						 description:"类型(1：5元券，2：10元券，3：20元券，4：50元券，5：100元券)",
						 type:"int",
						 optional:"FALSE",
						 dataColumn:"ticketTypeId"         },
					  typeName:{
						 description:"类型名称",
						 type:"string",
						 optional:"FALSE" ,
						 dataColumn:"investmentTicketType.ticketTypeName"             },
					  useInfo:{
						 description:"使用条件",
						 type:"string",
						 optional:"FALSE",
						 dataColumn:"investmentTicketType.useInfo"         },
					  useLimit:{
						 description:"使用限制",
						 type:"number",
						 optional:"FALSE",
						 dataColumn:"investmentTicketType.useLimit"         },
					  amount:{
						 description:"面值",
						 type:"number",
						 optional:"FALSE",
						 dataColumn:"investmentTicketType.denomination"         },
					  status:{
						 description:"状态(0, 1, 2)",
						 type:"int",
						 optional:"FALSE"         },
					  statusName:{
						 description:"状态名称(未使用(正常),已使用,已过期)",
						 type:"String",
						 optional:"FALSE",
						 value:"getDictLabel(status, 'customer_investment_ticket_dict', '')"         },
					  beginValidDate:{
						 description:"有效期-开始日期",
						 type:"String",
						 optional:"FALSE",
						 value:"formatDateByPattern(getDt,'yyyy-MM-dd')"         },
					  endValidDate:{
						 description:"有效期-结束日期",
						 type:"String",
						 optional:"FALSE",
					     dataColumn:"invalidDt"         },
					  getRemark:{
						 description:"来源备注",
						 type:"String",
						 optional:"FALSE"         }
					}
				  ]
				}
			}
			</foramt>
		</data>
	</api>
	
	<api path="withdrawCoupon">
		<data>
			<foramt>
			{
				code:{
				   description:"状态代码（0表示成功，1表示token无效，其它值表示失败）",
				   type:"int",
				   optional:"FALSE"   },
				text:{
				   description:"状态描述",
				   type:"String",
				   optional:"FALSE"   },
				data:{
				  useCount:{
					 description:"使用数量",
					 type:"int",
					 optional:"FALSE"     },
				  unusedCount:{
					 description:"未使用数量",
					 type:"int",
					 optional:"FALSE"     }
				}
			}
			</foramt>
		</data>
	</api>
	
	<api path="cashCouponStatistic">
		<data>
			<foramt>
			{
				code:{
				   description:"状态代码（0表示成功，1表示token无效，其它值表示失败）",
				   type:"int",
				   optional:"FALSE"   },
				text:{
				   description:"状态描述",
				   type:"String",
				   optional:"FALSE"   },
				data:{
				  cashCouponCount:{
					 description:"现金券总数量",
					 type:"int",
					 optional:"FALSE",
				     dataColumn:"count"     },
				  cashCouponAmount:{
					 description:"现金券总额",
					 type:"number",
					 optional:"FALSE",
					dataColumn:"sumDenomination"     }
				}
			}
			</foramt>
		</data>
	</api>
</apis>